{
  "schema_version": "1.0",
  "name": "example",
  "title": "Минимальный пример пресета",
  "description": "Минимально допустимый пресет: одна роль, один язык запросов, один сигнал. См. presets/recipe.yaml и docs/presets.md.",
  "roles": {
    "subject": {
      "min": 1,
      "max": 1,
      "queries": {
        "ru": ["главный объект"],
        "en": ["main subject"]
      },
      "weights": {
        "embedding": 0.6,
        "sharpness": 0.4
      },
      "constraints": {
        "min_sharpness": 0.3
      },
      "candidates": 10,
      "alternatives": 2
    }
  },
  "order": ["subject"],
  "min_step_gap_s": 10
}
